### ISSUE TITLE
add new domain *.8m88.com.

### ISSUE THREAD

**Issue by Tamahome-M** [smurfmonitor/dns-iptables-rules#23]
10:11:16.677306 IP myRdns4cli.26339 > 182.140.167.166.53: 56200 A? gahebbchgc.chalmtkrslmp.8m88.com. (50)
10:11:16.689278 IP myRdns4cli.60129 > 112.90.143.29.53: 20286 A? gahebbchgc.whubqnevaxaxenuz.8m88.com. (54)
10:11:16.689362 IP myRdns4cli.3994 > 182.140.167.166.53: 52432 A? yditsfyxyjqnozaz.8m88.com. (43)
10:11:16.778970 IP myRdns4cli.24194 > 182.140.167.166.53: 46619 A? zefjldeicuc.8m88.com. (38)
10:11:16.833805 IP myRdns4cli.16971 > 182.140.167.166.53: 20065 A? ffqvqmw.8m88.com. (34)
10:11:16.847504 IP myRdns4cli.37864 > 112.90.143.29.53: 47844 A? alsnqlezmb.8m88.com. (37)
10:11:16.901141 IP myRdns4cli.55514 > 182.140.167.188.53: 60166 A? lxbfeda.8m88.com. (34)
10:11:16.912794 IP myRdns4cli.57787 > 182.140.167.166.53: 9915 A? qvkbqb.8m88.com. (33)
10:11:16.919892 IP myRdns4cli.12991 > 183.60.52.217.53: 5938 A? upamqxxdl.8m88.com. (36)
10:11:16.957057 IP myRdns4cli.33119 > 112.90.143.29.53: 63344 A? zgrjrdshwsx.8m88.com. (38)
10:11:16.957145 IP myRdns4cli.62084 > 180.153.162.150.53: 29451 A? kkfiftbumsneyqt.8m88.com. (42)
10:11:16.970365 IP myRdns4cli.19291 > 180.153.9.189.53: 294 A? ojrexohpjsc.8m88.com. (38)
10:11:16.976014 IP myRdns4cli.15815 > 122.225.217.191.53: 52920 A? wubsaekxbie.8m88.com. (38)
