### ISSUE TITLE
Block sf123.com

### ISSUE THREAD

**Issue by Vasya-Kl** [smurfmonitor/dns-iptables-rules#17]
17:34:13.377830 IP 198.27.108.16.37959 > 195.58.xxx.domain: 3770+ A? mzcxkxsnydkdsngb.www.sf123.com. (48)
17:34:13.382572 IP 7.218.41.107.14111 > 195.58.xxx.domain: 27177+ A? qnexqvqr.www.sf123.com. (40)
17:34:13.382829 IP 71-220-116-27.mpls.qwest.net.469 > 195.58.xxxx.domain: 6772+ A? gzgjmbeb.www.sf123.com. (40)
17:34:13.383410 IP 195.58.xxx.domain > 7.218.41.107.14111: 27177 Refused- 0/0/0 (40)
